[
  {
    "id": "A-001",
    "lot": "7",
    "version": "V1-partiel",
    "preuve": "document+test"
  },
  {
    "id": "A-002",
    "lot": "7",
    "version": "V1",
    "preuve": "test"
  },
  {
    "id": "A-003",
    "lot": "3",
    "version": "V1",
    "preuve": "test+maquette"
  },
  {
    "id": "A-004",
    "lot": "6",
    "version": "V1",
    "preuve": "test+maquette"
  },
  {
    "id": "A-005",
    "lot": "1",
    "version": "V1",
    "preuve": "test"
  },
  {
    "id": "A-006",
    "lot": "2",
    "version": "V1-partiel",
    "preuve": "test"
  },
  {
    "id": "A-007",
    "lot": "7",
    "version": "V2",
    "preuve": "test"
  },
  {
    "id": "A-008",
    "lot": "7",
    "version": "V2",
    "preuve": "document+test"
  },
  {
    "id": "A-009",
    "lot": "7",
    "version": "V2",
    "preuve": "test"
  },
  {
    "id": "A-010",
    "lot": "7",
    "version": "V2",
    "preuve": "test"
  },
  {
    "id": "A-011",
    "lot": "2-ter",
    "version": "V1-partiel",
    "preuve": "test"
  },
  {
    "id": "A-012",
    "lot": "4",
    "version": "V1-partiel",
    "preuve": "test"
  },
  {
    "id": "A-013",
    "lot": "5",
    "version": "V1",
    "preuve": "test"
  },
  {
    "id": "A-014",
    "lot": "5",
    "version": "V1",
    "preuve": "test"
  },
  {
    "id": "A-015",
    "lot": "5",
    "version": "V1",
    "preuve": "test"
  },
  {
    "id": "A-016",
    "lot": "8a",
    "version": "V1",
    "preuve": "document"
  },
  {
    "id": "A-017",
    "lot": "4",
    "version": "V1",
    "preuve": "test"
  },
  {
    "id": "A-018",
    "lot": "3",
    "version": "V1",
    "preuve": "test+maquette"
  },
  {
    "id": "A-019",
    "lot": "2-bis",
    "version": "V1",
    "preuve": "test"
  },
  {
    "id": "A-020",
    "lot": "4",
    "version": "V1-partiel",
    "preuve": "test"
  },
  {
    "id": "A-021",
    "lot": "2-bis",
    "version": "V1",
    "preuve": "test"
  },
  {
    "id": "A-022",
    "lot": "2-bis",
    "version": "V1",
    "preuve": "test"
  },
  {
    "id": "A-023",
    "lot": "1",
    "version": "V1",
    "preuve": "document"
  },
  {
    "id": "A-024",
    "lot": "4",
    "version": "V1",
    "preuve": "test"
  },
  {
    "id": "A-025",
    "lot": "3",
    "version": "V1",
    "preuve": "test+maquette"
  },
  {
    "id": "A-026",
    "lot": "5",
    "version": "V1",
    "preuve": "test"
  },
  {
    "id": "A-027",
    "lot": "5",
    "version": "V1",
    "preuve": "test"
  },
  {
    "id": "A-028",
    "lot": "7",
    "version": "V1-partiel",
    "preuve": "test"
  },
  {
    "id": "A-029",
    "lot": "4",
    "version": "V1",
    "preuve": "test"
  },
  {
    "id": "A-030",
    "lot": "2",
    "version": "V1",
    "preuve": "test"
  },
  {
    "id": "A-031",
    "lot": "4",
    "version": "V1",
    "preuve": "test"
  },
  {
    "id": "A-032",
    "lot": "1",
    "version": "V1",
    "preuve": "document"
  },
  {
    "id": "A-033",
    "lot": "2b",
    "version": "V1",
    "preuve": "document+test"
  },
  {
    "id": "A-034",
    "lot": "4",
    "version": "V1",
    "preuve": "mesure"
  },
  {
    "id": "A-035",
    "lot": "2",
    "version": "V1",
    "preuve": "test"
  },
  {
    "id": "A-036",
    "lot": "8a",
    "version": "V1-partiel",
    "preuve": "document"
  },
  {
    "id": "A-037",
    "lot": "6",
    "version": "V1",
    "preuve": "test+maquette"
  },
  {
    "id": "A-038",
    "lot": "7",
    "version": "V1-partiel",
    "preuve": "test"
  },
  {
    "id": "A-039",
    "lot": "2",
    "version": "V1",
    "preuve": "test"
  },
  {
    "id": "A-040",
    "lot": "3",
    "version": "V1",
    "preuve": "test+maquette"
  },
  {
    "id": "A-041",
    "lot": "2",
    "version": "V1",
    "preuve": "test"
  },
  {
    "id": "A-042",
    "lot": "7",
    "version": "V1",
    "preuve": "test"
  },
  {
    "id": "A-043",
    "lot": "7",
    "version": "V1",
    "preuve": "test"
  },
  {
    "id": "A-044",
    "lot": "2",
    "version": "V1-partiel",
    "preuve": "test"
  },
  {
    "id": "A-045",
    "lot": "1",
    "version": "V1-partiel",
    "preuve": "document"
  },
  {
    "id": "A-046",
    "lot": "4",
    "version": "V1",
    "preuve": "test"
  },
  {
    "id": "A-047",
    "lot": "1",
    "version": "V1",
    "preuve": "test"
  },
  {
    "id": "A-048",
    "lot": "1",
    "version": "V1",
    "preuve": "test"
  },
  {
    "id": "A-049",
    "lot": "1",
    "version": "V1",
    "preuve": "test"
  },
  {
    "id": "A-050",
    "lot": "2b",
    "version": "V1",
    "preuve": "test"
  },
  {
    "id": "A-051",
    "lot": "1",
    "version": "V1",
    "preuve": "test"
  },
  {
    "id": "A-052",
    "lot": "4",
    "version": "V1-partiel",
    "preuve": "mesure"
  },
  {
    "id": "A-053",
    "lot": "4",
    "version": "V1",
    "preuve": "test"
  },
  {
    "id": "A-054",
    "lot": "1",
    "version": "V1",
    "preuve": "document"
  },
  {
    "id": "A-055",
    "lot": "4",
    "version": "V1",
    "preuve": "test"
  },
  {
    "id": "A-056",
    "lot": "4",
    "version": "V1",
    "preuve": "test"
  },
  {
    "id": "A-057",
    "lot": "4",
    "version": "V1",
    "preuve": "test"
  },
  {
    "id": "A-058",
    "lot": "1",
    "version": "V1",
    "preuve": "test"
  },
  {
    "id": "A-059",
    "lot": "1",
    "version": "V1",
    "preuve": "test"
  },
  {
    "id": "A-060",
    "lot": "1",
    "version": "V1",
    "preuve": "test"
  },
  {
    "id": "A-061",
    "lot": "1",
    "version": "V1",
    "preuve": "test"
  },
  {
    "id": "A-062",
    "lot": "1",
    "version": "V1",
    "preuve": "test"
  },
  {
    "id": "A-063",
    "lot": "4",
    "version": "V2",
    "preuve": "test"
  },
  {
    "id": "A-064",
    "lot": "4",
    "version": "V2",
    "preuve": "test"
  },
  {
    "id": "A-065",
    "lot": "5",
    "version": "V1",
    "preuve": "test"
  },
  {
    "id": "A-066",
    "lot": "1",
    "version": "V1",
    "preuve": "test"
  },
  {
    "id": "A-067",
    "lot": "1",
    "version": "V1",
    "preuve": "document"
  },
  {
    "id": "A-068",
    "lot": "1",
    "version": "V1",
    "preuve": "document"
  },
  {
    "id": "A-069",
    "lot": "1",
    "version": "V1",
    "preuve": "document"
  },
  {
    "id": "A-070",
    "lot": "8a",
    "version": "V1",
    "preuve": "exercice"
  },
  {
    "id": "A-071",
    "lot": "8a",
    "version": "V2",
    "preuve": "document"
  },
  {
    "id": "A-072",
    "lot": "1",
    "version": "V1",
    "preuve": "document"
  },
  {
    "id": "A-073",
    "lot": "2b",
    "version": "V1",
    "preuve": "document"
  },
  {
    "id": "A-074",
    "lot": "2b",
    "version": "V2",
    "preuve": "document"
  },
  {
    "id": "A-075",
    "lot": "2b",
    "version": "V2",
    "preuve": "document"
  },
  {
    "id": "A-076",
    "lot": "4",
    "version": "V1-partiel",
    "preuve": "document"
  },
  {
    "id": "A-077",
    "lot": "1",
    "version": "V1",
    "preuve": "document"
  },
  {
    "id": "A-078",
    "lot": "8a",
    "version": "V2",
    "preuve": "document"
  },
  {
    "id": "A-079",
    "lot": "1",
    "version": "V1",
    "preuve": "document"
  },
  {
    "id": "A-080",
    "lot": "5",
    "version": "V1",
    "preuve": "document"
  },
  {
    "id": "A-081",
    "lot": "1",
    "version": "V1",
    "preuve": "test"
  },
  {
    "id": "A-082",
    "lot": "2-bis",
    "version": "V1",
    "preuve": "test+maquette"
  },
  {
    "id": "A-083",
    "lot": "1",
    "version": "V1",
    "preuve": "test"
  },
  {
    "id": "A-084",
    "lot": "1",
    "version": "V1",
    "preuve": "test"
  },
  {
    "id": "A-085",
    "lot": "1",
    "version": "V1",
    "preuve": "test"
  },
  {
    "id": "A-086",
    "lot": "1",
    "version": "V1",
    "preuve": "test"
  },
  {
    "id": "A-087",
    "lot": "1",
    "version": "V1",
    "preuve": "document"
  },
  {
    "id": "A-088",
    "lot": "2",
    "version": "V1",
    "preuve": "test"
  },
  {
    "id": "A-089",
    "lot": "2-bis",
    "version": "V1",
    "preuve": "test"
  },
  {
    "id": "A-090",
    "lot": "2-bis",
    "version": "V1",
    "preuve": "test"
  },
  {
    "id": "A-091",
    "lot": "2",
    "version": "V1",
    "preuve": "test"
  },
  {
    "id": "A-092",
    "lot": "2-bis",
    "version": "V1",
    "preuve": "test"
  },
  {
    "id": "A-093",
    "lot": "2-bis",
    "version": "V1",
    "preuve": "test"
  },
  {
    "id": "A-094",
    "lot": "2-bis",
    "version": "V1",
    "preuve": "test"
  },
  {
    "id": "A-095",
    "lot": "2-bis",
    "version": "V1",
    "preuve": "test"
  },
  {
    "id": "A-096",
    "lot": "2-bis",
    "version": "V1",
    "preuve": "test"
  },
  {
    "id": "A-097",
    "lot": "2-bis",
    "version": "V1",
    "preuve": "test"
  },
  {
    "id": "A-098",
    "lot": "2-bis",
    "version": "V1",
    "preuve": "test"
  },
  {
    "id": "A-099",
    "lot": "2-bis",
    "version": "V1",
    "preuve": "test"
  },
  {
    "id": "A-100",
    "lot": "2-bis",
    "version": "V1",
    "preuve": "test"
  },
  {
    "id": "A-101",
    "lot": "2-bis",
    "version": "V1",
    "preuve": "test"
  },
  {
    "id": "A-102",
    "lot": "2-bis",
    "version": "V1",
    "preuve": "test"
  },
  {
    "id": "A-103",
    "lot": "2-bis",
    "version": "V1",
    "preuve": "test"
  },
  {
    "id": "A-104",
    "lot": "3",
    "version": "V1",
    "preuve": "test+maquette"
  },
  {
    "id": "A-105",
    "lot": "3",
    "version": "V1",
    "preuve": "test+maquette"
  },
  {
    "id": "A-106",
    "lot": "3",
    "version": "V1",
    "preuve": "test+maquette"
  },
  {
    "id": "A-107",
    "lot": "2-bis",
    "version": "V1",
    "preuve": "test+maquette"
  },
  {
    "id": "A-108",
    "lot": "3",
    "version": "V1",
    "preuve": "test"
  },
  {
    "id": "A-109",
    "lot": "2-ter",
    "version": "V1",
    "preuve": "test"
  },
  {
    "id": "A-110",
    "lot": "2-ter",
    "version": "V1",
    "preuve": "test"
  },
  {
    "id": "A-111",
    "lot": "2-ter",
    "version": "V1",
    "preuve": "test+maquette"
  },
  {
    "id": "A-112",